{"apiVersion":"assent.dev/v1alpha1","kind":"DecisionRecord","decision":"REVIEW","findings":{"observed":[],"enforcing":[{"rule":"partitions-monotonic","obligation":"partitions-not-decreased","effect":"challenge","subject":"file:topics/orders.events.v1.yaml","points":0,"code":"PARTITIONS_DECREASED"}]},"pins":{"toolVersion":"0.0.0-dev","toolDigest":"sha256:752ff9dd0baea6b2178a1bd2966a33e27fdcf5061941c2562125e03a93b6f607","policySha":"sha256:4215e4247ecc2d823f7062db98a380e5091f5b9a0703cd12dedf40e50ac6fe39","sourceSha":"eb3a444b894eeb495821f0e6654198dc869d0845","targetSha":"0aee1a66aaa6b19a8ff9d929ec2d24ed491c19eb","mergeResultDigest":null,"capabilityGap":"gitlab plain-merge exposes no merge-result digest (no merge train); ADR-0017 §1 capabilityGap","factsResolvedAt":{}}}