{"apiVersion":"assent.dev/v1alpha1","kind":"DecisionRecord","decision":"APPROVE","findings":{"observed":[],"enforcing":[]},"pins":{"toolVersion":"0.0.0-dev","toolDigest":"sha256:752ff9dd0baea6b2178a1bd2966a33e27fdcf5061941c2562125e03a93b6f607","policySha":"sha256:4215e4247ecc2d823f7062db98a380e5091f5b9a0703cd12dedf40e50ac6fe39","sourceSha":"9a816d4ceaa3037d132ab0ddfe16f2c0a82c2a61","targetSha":"0aee1a66aaa6b19a8ff9d929ec2d24ed491c19eb","mergeResultDigest":null,"capabilityGap":"gitlab plain-merge exposes no merge-result digest (no merge train); ADR-0017 §1 capabilityGap","factsResolvedAt":{}}}