{
  "apiVersion": "assent.dev/v1alpha1",
  "kind": "DecisionRecord",
  "decision": "BLOCK",
  "findings": {
    "observed": [],
    "enforcing": [
      {
        "rule": "topic-owner-must-approve",
        "obligation": "ownership",
        "effect": "require-review",
        "subject": "topic-registry:orders.events.v1",
        "points": 0,
        "code": "ownership-approval-missing"
      },
      {
        "rule": "partitions-must-not-shrink",
        "obligation": "non-destructive",
        "effect": "block",
        "subject": "topic-registry:orders.events.v1",
        "points": 10,
        "code": "partition-count-shrunk"
      },
      {
        "rule": "topic-owner-must-approve",
        "obligation": "ownership",
        "effect": "require-review",
        "subject": "topic-registry:payments.settled.v2",
        "points": 0,
        "code": "ownership-approval-missing"
      }
    ]
  },
  "pins": {
    "toolVersion": "0.1.0",
    "toolDigest": "sha256:00112233445566778899aabbccddeeff00112233445566778899aabbccddeeff",
    "policySha": "sha256:aabb00112233445566778899ccddeeff00112233445566778899aabbccddeeff",
    "sourceSha": "1f0c3ab9d2e4c5a6b7089a1b2c3d4e5f60718293",
    "targetSha": "a4b5c6d7e8f9001122334455667788990011aabb",
    "mergeResultDigest": "sha256:9f8e7d6c5b4a39281706f5e4d3c2b1a09f8e7d6c5b4a39281706f5e4d3c2b1a0",
    "factsResolvedAt": {
      "owner": "2026-07-24T09:00:00Z",
      "quota": "2026-07-24T09:00:00Z"
    }
  }
}
