{
  "apiVersion": "assent.dev/v1alpha1",
  "kind": "DecisionRecord",
  "decision": "BLOCK",
  "findings": {
    "observed": [],
    "enforcing": [
      {
        "rule": "partitions-must-not-shrink",
        "effect": "block",
        "subject": "topic-registry:orders.events.v1",
        "points": 10,
        "code": "partition-count-shrunk"
      },
      {
        "rule": "partitions-must-not-shrink",
        "effect": "block",
        "subject": "topic-registry:orders.events.v1",
        "points": 5,
        "code": "partition-count-shrunk-alt"
      }
    ]
  },
  "pins": {
    "toolVersion": "0.1.0",
    "toolDigest": "sha256:aaaa",
    "policySha": "sha256:bbbb",
    "sourceSha": "cccc",
    "targetSha": "dddd",
    "mergeResultDigest": "sha256:eeee",
    "factsResolvedAt": {}
  }
}
